{
  "schema_version": "reference_detection_v3_schema_v1",
  "detector_version": "target_output_detection_v3_page_content_isolated",
  "task_id": "B024-RDV3-BATCH-007-1130808",
  "project_id": "1130808",
  "status": "PARTIAL_REFERENCE_SET",
  "target_types_present": [
    "SHEETMETAL_DRAWING"
  ],
  "effective_pages": [
    {
      "neutral_reference_file_id": "SRC-ALL-PROJECTS-FILE-309C9BDE3471",
      "file_sha256": "36E5238AAA625DCE776DBA45EF7EF3FDA8AC6ECA1CDF23D1631E4C786F2DB13A",
      "page_range": "1-2",
      "target_type": "SHEETMETAL_DRAWING",
      "project_identity_status": "CONFIRMED",
      "panel_or_sheet_identity": null,
      "revision_identity": null,
      "supersedes": null,
      "current_effective_status": "CURRENT_EFFECTIVE",
      "classification_method": "METADATA_ROLE_AFTER_RENDERED_PAGE_NO_TEXT",
      "confidence": 0.88,
      "evidence_ids": [
        "RPE-18A88535B4DD3E",
        "RPE-7DEB3AB64AF502",
        "VIS-1F90C0A6A753CA24"
      ]
    },
    {
      "neutral_reference_file_id": "SRC-ALL-PROJECTS-FILE-3894CC71DC62",
      "file_sha256": "312C3FAA305053E5FD09A25DDA03EB4DD67CD2DEE502968D0433CF0420BC7AEB",
      "page_range": "1-2",
      "target_type": "SHEETMETAL_DRAWING",
      "project_identity_status": "CONFIRMED",
      "panel_or_sheet_identity": null,
      "revision_identity": null,
      "supersedes": null,
      "current_effective_status": "CURRENT_EFFECTIVE",
      "classification_method": "METADATA_ROLE_AFTER_RENDERED_PAGE_NO_TEXT",
      "confidence": 0.88,
      "evidence_ids": [
        "RPE-58A39652F9C1AB",
        "RPE-E5B9454B79DBC9",
        "VIS-1F90C0A6A753CA24"
      ]
    },
    {
      "neutral_reference_file_id": "SRC-ALL-PROJECTS-FILE-586F24741382",
      "file_sha256": "F5198E13B2310E2C2B1EA52DB0F7C6326CAB49E203755F9152F68384818F3AE7",
      "page_range": "1",
      "target_type": "SHEETMETAL_DRAWING",
      "project_identity_status": "CONFIRMED",
      "panel_or_sheet_identity": null,
      "revision_identity": null,
      "supersedes": null,
      "current_effective_status": "CURRENT_EFFECTIVE",
      "classification_method": "METADATA_ROLE_AFTER_RENDERED_PAGE_NO_TEXT",
      "confidence": 0.88,
      "evidence_ids": [
        "RPE-3A18B01FF5E034",
        "VIS-1F90C0A6A753CA24"
      ]
    },
    {
      "neutral_reference_file_id": "SRC-ALL-PROJECTS-FILE-E8B3180F58FA",
      "file_sha256": "9529EB6F08D7E461AD6C9679FF4AD55CD829B35CBC713A35E7E8A9CD1F8D012A",
      "page_range": "1",
      "target_type": "SHEETMETAL_DRAWING",
      "project_identity_status": "CONFIRMED",
      "panel_or_sheet_identity": null,
      "revision_identity": null,
      "supersedes": null,
      "current_effective_status": "CURRENT_EFFECTIVE",
      "classification_method": "METADATA_ROLE_AFTER_RENDERED_PAGE_NO_TEXT",
      "confidence": 0.88,
      "evidence_ids": [
        "RPE-8F075E7CA6EAC7",
        "VIS-1F90C0A6A753CA24"
      ]
    }
  ],
  "duplicate_groups": [],
  "unresolved_issues": [
    "ELECTRICAL_DRAWINGS_PRESENT_AND_EXCLUDED_FROM_TARGET_SET",
    "UNCLASSIFIED_PAGES_REMAIN"
  ],
  "generator_exposure": {
    "generator_receives_reference_file_ids": false,
    "generator_receives_reference_hashes": false,
    "generator_receives_reference_paths": false,
    "generator_receives_reference_content": false
  },
  "minimization": {
    "raw_text_persisted": false,
    "rendered_images_persisted": false,
    "title_crops_persisted": false,
    "absolute_private_paths_persisted": false,
    "drawing_details_persisted": false
  }
}
