{
  "schema_version": "reference_detection_v3_schema_v1",
  "detector_version": "target_output_detection_v3_page_content_isolated",
  "task_id": "B024-RDV3-BATCH-006-1130605",
  "project_id": "1130605",
  "status": "PARTIAL_REFERENCE_SET",
  "target_types_present": [
    "SHEETMETAL_DRAWING"
  ],
  "effective_pages": [
    {
      "neutral_reference_file_id": "SRC-ALL-PROJECTS-FILE-29B5D6376CBF",
      "file_sha256": "43BDE8B307D161EB214837C5987CE24C7691CA13A0A4516780229EE33B31FF07",
      "page_range": "1",
      "target_type": "SHEETMETAL_DRAWING",
      "project_identity_status": "CONFIRMED",
      "panel_or_sheet_identity": null,
      "revision_identity": null,
      "supersedes": null,
      "current_effective_status": "CURRENT_EFFECTIVE",
      "classification_method": "METADATA_ROLE_AFTER_RENDERED_PAGE_NO_TEXT",
      "confidence": 0.88,
      "evidence_ids": [
        "RPE-69A233479CFD70",
        "VIS-F6CF0C67659513C7"
      ]
    },
    {
      "neutral_reference_file_id": "SRC-ALL-PROJECTS-FILE-363E7D6DD860",
      "file_sha256": "E13AD64EED44BBF84B5131F320F57308EA7847E2977C45FF557CF3238A69798A",
      "page_range": "1",
      "target_type": "SHEETMETAL_DRAWING",
      "project_identity_status": "CONFIRMED",
      "panel_or_sheet_identity": null,
      "revision_identity": null,
      "supersedes": null,
      "current_effective_status": "CURRENT_EFFECTIVE",
      "classification_method": "METADATA_ROLE_AFTER_RENDERED_PAGE_NO_TEXT",
      "confidence": 0.88,
      "evidence_ids": [
        "RPE-64D7AF366D1C8A",
        "VIS-F6CF0C67659513C7"
      ]
    },
    {
      "neutral_reference_file_id": "SRC-ALL-PROJECTS-FILE-66A6F9ED9EDD",
      "file_sha256": "E0C4D5AD6CE957CDE45C887496B988638701F614AD10178563C80634D80108B1",
      "page_range": "1",
      "target_type": "SHEETMETAL_DRAWING",
      "project_identity_status": "CONFIRMED",
      "panel_or_sheet_identity": null,
      "revision_identity": null,
      "supersedes": null,
      "current_effective_status": "CURRENT_EFFECTIVE",
      "classification_method": "METADATA_ROLE_AFTER_RENDERED_PAGE_NO_TEXT",
      "confidence": 0.88,
      "evidence_ids": [
        "RPE-13860D33C0965E",
        "VIS-D01A644DC0145814"
      ]
    },
    {
      "neutral_reference_file_id": "SRC-ALL-PROJECTS-FILE-66FEC0FB71D5",
      "file_sha256": "C0AFFF9C82294B5B054D34FC219E1C14EC923D10947A9D15B37C8BAB1CF42241",
      "page_range": "1",
      "target_type": "SHEETMETAL_DRAWING",
      "project_identity_status": "CONFIRMED",
      "panel_or_sheet_identity": null,
      "revision_identity": null,
      "supersedes": null,
      "current_effective_status": "CURRENT_EFFECTIVE",
      "classification_method": "METADATA_ROLE_AFTER_RENDERED_PAGE_NO_TEXT",
      "confidence": 0.88,
      "evidence_ids": [
        "RPE-21E58C6EAD319D",
        "VIS-EE1F57B9EC708875"
      ]
    },
    {
      "neutral_reference_file_id": "SRC-ALL-PROJECTS-FILE-74404FF9FC25",
      "file_sha256": "7978373FD6B26484DC47C21F1432C050EC791B43EA202DA22CA74FDF7FF915F6",
      "page_range": "1",
      "target_type": "SHEETMETAL_DRAWING",
      "project_identity_status": "CONFIRMED",
      "panel_or_sheet_identity": null,
      "revision_identity": null,
      "supersedes": null,
      "current_effective_status": "CURRENT_EFFECTIVE",
      "classification_method": "METADATA_ROLE_AFTER_RENDERED_PAGE_NO_TEXT",
      "confidence": 0.88,
      "evidence_ids": [
        "RPE-A1B21194DFF15A",
        "VIS-D01A644DC0145814"
      ]
    },
    {
      "neutral_reference_file_id": "SRC-ALL-PROJECTS-FILE-E2DE6D271EC6",
      "file_sha256": "8D1B3672635AD2398908E0BEE3E5DBF999DB1B34338CE8947869418E546E2285",
      "page_range": "1-6",
      "target_type": "SHEETMETAL_DRAWING",
      "project_identity_status": "CONFIRMED",
      "panel_or_sheet_identity": null,
      "revision_identity": null,
      "supersedes": null,
      "current_effective_status": "CURRENT_EFFECTIVE",
      "classification_method": "METADATA_ROLE_AFTER_RENDERED_PAGE_NO_TEXT",
      "confidence": 0.88,
      "evidence_ids": [
        "RPE-12887C5B605CF3",
        "RPE-28B686D4A71DC9",
        "RPE-46B82DFE0A74AD",
        "RPE-51E661A844BA53",
        "RPE-D6F7AECCB206AF",
        "RPE-D7F2E3999163C4",
        "VIS-1F90C0A6A753CA24",
        "VIS-DB44A02B340CCEDE"
      ]
    },
    {
      "neutral_reference_file_id": "SRC-ALL-PROJECTS-FILE-E774870DDCAF",
      "file_sha256": "2157F664ABCC23F937FBCA564DE7F2E0396A96DF56AA47EBC4C76DB8693C9EB8",
      "page_range": "1",
      "target_type": "SHEETMETAL_DRAWING",
      "project_identity_status": "CONFIRMED",
      "panel_or_sheet_identity": null,
      "revision_identity": null,
      "supersedes": null,
      "current_effective_status": "CURRENT_EFFECTIVE",
      "classification_method": "METADATA_ROLE_AFTER_RENDERED_PAGE_NO_TEXT",
      "confidence": 0.88,
      "evidence_ids": [
        "RPE-DD13D8DABE2865",
        "VIS-D01A644DC0145814"
      ]
    }
  ],
  "duplicate_groups": [
    {
      "original_neutral_reference_file_id": "SRC-ALL-PROJECTS-FILE-E2DE6D271EC6",
      "duplicate_neutral_reference_file_ids": [
        "SRC-ALL-PROJECTS-FILE-8F8800D417B5"
      ]
    }
  ],
  "unresolved_issues": [
    "ELECTRICAL_DRAWINGS_PRESENT_AND_EXCLUDED_FROM_TARGET_SET",
    "UNCLASSIFIED_PAGES_REMAIN"
  ],
  "generator_exposure": {
    "generator_receives_reference_file_ids": false,
    "generator_receives_reference_hashes": false,
    "generator_receives_reference_paths": false,
    "generator_receives_reference_content": false
  },
  "minimization": {
    "raw_text_persisted": false,
    "rendered_images_persisted": false,
    "title_crops_persisted": false,
    "absolute_private_paths_persisted": false,
    "drawing_details_persisted": false
  }
}
