{
  "schema_version": "reference_detection_v3_schema_v1",
  "detector_version": "target_output_detection_v3_page_content_isolated",
  "task_id": "B024-RDV3-BATCH-005-1150204",
  "project_id": "1150204",
  "status": "PARTIAL_REFERENCE_SET",
  "target_types_present": [
    "SHEETMETAL_DRAWING"
  ],
  "effective_pages": [
    {
      "neutral_reference_file_id": "SRC-ALL-PROJECTS-FILE-1E62B43C94E5",
      "file_sha256": "5DF4F6296858A20C07CE50AB067AA302158363461DFEB982BD86404EF5D63F7D",
      "page_range": "1",
      "target_type": "SHEETMETAL_DRAWING",
      "project_identity_status": "CONFIRMED",
      "panel_or_sheet_identity": null,
      "revision_identity": null,
      "supersedes": null,
      "current_effective_status": "CURRENT_EFFECTIVE",
      "classification_method": "METADATA_ROLE_AFTER_RENDERED_PAGE_NO_TEXT",
      "confidence": 0.88,
      "evidence_ids": [
        "RPE-870879A16EDDC0",
        "VIS-256D4CE04F3CA973"
      ]
    },
    {
      "neutral_reference_file_id": "SRC-ALL-PROJECTS-FILE-32E5C235C599",
      "file_sha256": "00FDA8D2F3FE247525D7D755EE73BA46051E0C76BD42C7E70405D7CB7018FA21",
      "page_range": "1",
      "target_type": "SHEETMETAL_DRAWING",
      "project_identity_status": "CONFIRMED",
      "panel_or_sheet_identity": null,
      "revision_identity": null,
      "supersedes": null,
      "current_effective_status": "CURRENT_EFFECTIVE",
      "classification_method": "METADATA_ROLE_AFTER_RENDERED_PAGE_NO_TEXT",
      "confidence": 0.88,
      "evidence_ids": [
        "RPE-706F43F05E6FB3",
        "VIS-256D4CE04F3CA973"
      ]
    },
    {
      "neutral_reference_file_id": "SRC-ALL-PROJECTS-FILE-5C6974981D12",
      "file_sha256": "7A0EBCB4E597720D66979FAB6834708ABD38595E70A26E35CEFFDBDA538AE40D",
      "page_range": "1",
      "target_type": "SHEETMETAL_DRAWING",
      "project_identity_status": "CONFIRMED",
      "panel_or_sheet_identity": null,
      "revision_identity": null,
      "supersedes": null,
      "current_effective_status": "CURRENT_EFFECTIVE",
      "classification_method": "METADATA_ROLE_AFTER_RENDERED_PAGE_NO_TEXT",
      "confidence": 0.88,
      "evidence_ids": [
        "RPE-69E90B6F03F467",
        "VIS-EE1F57B9EC708875"
      ]
    },
    {
      "neutral_reference_file_id": "SRC-ALL-PROJECTS-FILE-C0202B7F25D3",
      "file_sha256": "9ABC236DA3A86EABB4C3199FA65F8F226ADDF12344AA2B346E77F7AD9DCF3409",
      "page_range": "1",
      "target_type": "SHEETMETAL_DRAWING",
      "project_identity_status": "CONFIRMED",
      "panel_or_sheet_identity": null,
      "revision_identity": null,
      "supersedes": null,
      "current_effective_status": "CURRENT_EFFECTIVE",
      "classification_method": "METADATA_ROLE_AFTER_RENDERED_PAGE_NO_TEXT",
      "confidence": 0.88,
      "evidence_ids": [
        "RPE-2E8B6A54696E77",
        "VIS-F6CF0C67659513C7"
      ]
    },
    {
      "neutral_reference_file_id": "SRC-ALL-PROJECTS-FILE-D1ADBA2D0E6F",
      "file_sha256": "EC8566066D314EC5CBA672592B4D682B676CE596DB48011CDD931C3DBA6CEAF8",
      "page_range": "1",
      "target_type": "SHEETMETAL_DRAWING",
      "project_identity_status": "CONFIRMED",
      "panel_or_sheet_identity": null,
      "revision_identity": null,
      "supersedes": null,
      "current_effective_status": "CURRENT_EFFECTIVE",
      "classification_method": "METADATA_ROLE_AFTER_RENDERED_PAGE_NO_TEXT",
      "confidence": 0.88,
      "evidence_ids": [
        "RPE-88090343C6189D",
        "VIS-256D4CE04F3CA973"
      ]
    },
    {
      "neutral_reference_file_id": "SRC-ALL-PROJECTS-FILE-D8BE1EFD2EB9",
      "file_sha256": "A537C6713B47D819BC739A1566F9CAB0F848D04E82F8155582C62C6E2197225D",
      "page_range": "1-8",
      "target_type": "SHEETMETAL_DRAWING",
      "project_identity_status": "CONFIRMED",
      "panel_or_sheet_identity": null,
      "revision_identity": null,
      "supersedes": null,
      "current_effective_status": "CURRENT_EFFECTIVE",
      "classification_method": "METADATA_ROLE_AFTER_RENDERED_PAGE_NO_TEXT",
      "confidence": 0.88,
      "evidence_ids": [
        "RPE-0304912CF665D0",
        "RPE-38517DE4A5011D",
        "RPE-4C5E68C5A9C7E7",
        "RPE-94470B121C9FA2",
        "RPE-B283D6C8D7C672",
        "RPE-D2E37A4E159A3C",
        "RPE-F21725C30F5DAF",
        "RPE-F22AC5BD3717F1",
        "VIS-1F90C0A6A753CA24",
        "VIS-DB44A02B340CCEDE"
      ]
    },
    {
      "neutral_reference_file_id": "SRC-ALL-PROJECTS-FILE-E3C3AD6305D6",
      "file_sha256": "DA2F4718801158A145508ABD1CB7C5FF4F5830D82E8F063B5AF59AEA2F6FC529",
      "page_range": "1",
      "target_type": "SHEETMETAL_DRAWING",
      "project_identity_status": "CONFIRMED",
      "panel_or_sheet_identity": null,
      "revision_identity": null,
      "supersedes": null,
      "current_effective_status": "CURRENT_EFFECTIVE",
      "classification_method": "METADATA_ROLE_AFTER_RENDERED_PAGE_NO_TEXT",
      "confidence": 0.88,
      "evidence_ids": [
        "RPE-637F592310704F",
        "VIS-D01A644DC0145814"
      ]
    },
    {
      "neutral_reference_file_id": "SRC-ALL-PROJECTS-FILE-E3F1ECB4CCE3",
      "file_sha256": "5F38C3C50C79DE2C0B98FEB53748E9D45C27E09066781567AA1D4491B141143F",
      "page_range": "1",
      "target_type": "SHEETMETAL_DRAWING",
      "project_identity_status": "CONFIRMED",
      "panel_or_sheet_identity": null,
      "revision_identity": null,
      "supersedes": null,
      "current_effective_status": "CURRENT_EFFECTIVE",
      "classification_method": "METADATA_ROLE_AFTER_RENDERED_PAGE_NO_TEXT",
      "confidence": 0.88,
      "evidence_ids": [
        "RPE-CF94E80604AD6F",
        "VIS-256D4CE04F3CA973"
      ]
    },
    {
      "neutral_reference_file_id": "SRC-ALL-PROJECTS-FILE-E410F00E042F",
      "file_sha256": "CA573A6E59A08C34939F77BC937EF09D5DFAFB9B99B9F4207B667692D876224B",
      "page_range": "1-8",
      "target_type": "SHEETMETAL_DRAWING",
      "project_identity_status": "CONFIRMED",
      "panel_or_sheet_identity": null,
      "revision_identity": null,
      "supersedes": null,
      "current_effective_status": "CURRENT_EFFECTIVE",
      "classification_method": "METADATA_ROLE_AFTER_RENDERED_PAGE_NO_TEXT",
      "confidence": 0.88,
      "evidence_ids": [
        "RPE-4348BB8C570D20",
        "RPE-5377189DC7B43F",
        "RPE-8BB7F988088291",
        "RPE-940A314257242D",
        "RPE-AE1AC38A0F181A",
        "RPE-B3BE7CEAD990E8",
        "RPE-C55AA69F1D4542",
        "RPE-FD1D25BB41132E",
        "VIS-1F90C0A6A753CA24",
        "VIS-DB44A02B340CCEDE"
      ]
    },
    {
      "neutral_reference_file_id": "SRC-ALL-PROJECTS-FILE-F65ED63173F9",
      "file_sha256": "F01A1A64529A2306F93D0244D13EABC29DCDA220C938844FA8F0550FE5E90A76",
      "page_range": "1",
      "target_type": "SHEETMETAL_DRAWING",
      "project_identity_status": "CONFIRMED",
      "panel_or_sheet_identity": null,
      "revision_identity": null,
      "supersedes": null,
      "current_effective_status": "CURRENT_EFFECTIVE",
      "classification_method": "METADATA_ROLE_AFTER_RENDERED_PAGE_NO_TEXT",
      "confidence": 0.88,
      "evidence_ids": [
        "RPE-42EC9F5F135FF3",
        "VIS-F6CF0C67659513C7"
      ]
    }
  ],
  "duplicate_groups": [],
  "unresolved_issues": [
    "ELECTRICAL_DRAWINGS_PRESENT_AND_EXCLUDED_FROM_TARGET_SET",
    "UNCLASSIFIED_PAGES_REMAIN"
  ],
  "generator_exposure": {
    "generator_receives_reference_file_ids": false,
    "generator_receives_reference_hashes": false,
    "generator_receives_reference_paths": false,
    "generator_receives_reference_content": false
  },
  "minimization": {
    "raw_text_persisted": false,
    "rendered_images_persisted": false,
    "title_crops_persisted": false,
    "absolute_private_paths_persisted": false,
    "drawing_details_persisted": false
  }
}
