{
  "schema_version": "reference_detection_v3_schema_v1",
  "detector_version": "target_output_detection_v3_page_content_isolated",
  "task_id": "B024-RDV3-BATCH-014-1131004",
  "project_id": "1131004",
  "status": "PARTIAL_REFERENCE_SET",
  "target_types_present": [
    "SHEETMETAL_DRAWING"
  ],
  "effective_pages": [
    {
      "neutral_reference_file_id": "SRC-ALL-PROJECTS-FILE-1AD05A82DD36",
      "file_sha256": "B352771C8AC6B4E3B875B08797BB46575F48C58BB6B5E3694B72E20221A29F5D",
      "page_range": "1",
      "target_type": "SHEETMETAL_DRAWING",
      "project_identity_status": "CONFIRMED",
      "panel_or_sheet_identity": null,
      "revision_identity": null,
      "supersedes": null,
      "current_effective_status": "CURRENT_EFFECTIVE",
      "classification_method": "METADATA_ROLE_AFTER_RENDERED_PAGE_NO_TEXT",
      "confidence": 0.88,
      "evidence_ids": [
        "RPE-33382DDE35B839",
        "VIS-3DA5DC7FF6AE5163"
      ]
    },
    {
      "neutral_reference_file_id": "SRC-ALL-PROJECTS-FILE-7E743E7DAA4D",
      "file_sha256": "C06C4F474FDA0A789E5FDEC72419D3060EB9370F9B6F9CC699F67D1EC34A1B40",
      "page_range": "1-2",
      "target_type": "SHEETMETAL_DRAWING",
      "project_identity_status": "CONFIRMED",
      "panel_or_sheet_identity": null,
      "revision_identity": null,
      "supersedes": null,
      "current_effective_status": "CURRENT_EFFECTIVE",
      "classification_method": "METADATA_ROLE_AFTER_RENDERED_PAGE_NO_TEXT",
      "confidence": 0.88,
      "evidence_ids": [
        "RPE-EFE49C566B80F4",
        "RPE-FF24957B715D34",
        "VIS-1F90C0A6A753CA24",
        "VIS-DB44A02B340CCEDE"
      ]
    },
    {
      "neutral_reference_file_id": "SRC-ALL-PROJECTS-FILE-810BEA6755E2",
      "file_sha256": "72E5643E3FC6D8F92070EB7CB42706FD641C1F40F40BC9A35990206334CF9C11",
      "page_range": "1",
      "target_type": "SHEETMETAL_DRAWING",
      "project_identity_status": "CONFIRMED",
      "panel_or_sheet_identity": null,
      "revision_identity": null,
      "supersedes": null,
      "current_effective_status": "CURRENT_EFFECTIVE",
      "classification_method": "METADATA_ROLE_AFTER_RENDERED_PAGE_NO_TEXT",
      "confidence": 0.88,
      "evidence_ids": [
        "RPE-8E298F6A37FF8D",
        "VIS-3DA5DC7FF6AE5163"
      ]
    },
    {
      "neutral_reference_file_id": "SRC-ALL-PROJECTS-FILE-99D3BB96BC8F",
      "file_sha256": "D7DB25A204484D56DAA80017ADF8BB8171F252696A6C0B4E54FC6AA9B976611F",
      "page_range": "1-2",
      "target_type": "SHEETMETAL_DRAWING",
      "project_identity_status": "CONFIRMED",
      "panel_or_sheet_identity": null,
      "revision_identity": null,
      "supersedes": null,
      "current_effective_status": "CURRENT_EFFECTIVE",
      "classification_method": "METADATA_ROLE_AFTER_RENDERED_PAGE_NO_TEXT",
      "confidence": 0.88,
      "evidence_ids": [
        "RPE-1165159D4D620B",
        "RPE-AF1C9A795348CB",
        "VIS-DB44A02B340CCEDE"
      ]
    }
  ],
  "duplicate_groups": [],
  "unresolved_issues": [
    "ELECTRICAL_DRAWINGS_PRESENT_AND_EXCLUDED_FROM_TARGET_SET",
    "UNCLASSIFIED_PAGES_REMAIN"
  ],
  "generator_exposure": {
    "generator_receives_reference_file_ids": false,
    "generator_receives_reference_hashes": false,
    "generator_receives_reference_paths": false,
    "generator_receives_reference_content": false
  },
  "minimization": {
    "raw_text_persisted": false,
    "rendered_images_persisted": false,
    "title_crops_persisted": false,
    "absolute_private_paths_persisted": false,
    "drawing_details_persisted": false
  }
}
