{
  "schema_version": "reference_detection_v3_schema_v1",
  "detector_version": "target_output_detection_v3_page_content_isolated",
  "task_id": "B024-RDV3-BATCH-010-1130207",
  "project_id": "1130207",
  "status": "PARTIAL_REFERENCE_SET",
  "target_types_present": [
    "SHEETMETAL_DRAWING"
  ],
  "effective_pages": [
    {
      "neutral_reference_file_id": "SRC-ALL-PROJECTS-FILE-3CE3408140F2",
      "file_sha256": "11FCFB45B66F647990FF0D356813BCBA83F83FD2D3AFDC852B06838AA29BD162",
      "page_range": "1",
      "target_type": "SHEETMETAL_DRAWING",
      "project_identity_status": "CONFIRMED",
      "panel_or_sheet_identity": null,
      "revision_identity": null,
      "supersedes": null,
      "current_effective_status": "CURRENT_EFFECTIVE",
      "classification_method": "METADATA_ROLE_AFTER_RENDERED_PAGE_NO_TEXT",
      "confidence": 0.88,
      "evidence_ids": [
        "RPE-5993616CCF30F3",
        "VIS-ADE2F1C0861742EF"
      ]
    },
    {
      "neutral_reference_file_id": "SRC-ALL-PROJECTS-FILE-3DAE21B3D314",
      "file_sha256": "88D83F640CDB7AA94B371AA60CD581C6C551E032970F11B80BDF205A3B1F05B3",
      "page_range": "1",
      "target_type": "SHEETMETAL_DRAWING",
      "project_identity_status": "CONFIRMED",
      "panel_or_sheet_identity": null,
      "revision_identity": null,
      "supersedes": null,
      "current_effective_status": "CURRENT_EFFECTIVE",
      "classification_method": "METADATA_ROLE_AFTER_RENDERED_PAGE_NO_TEXT",
      "confidence": 0.88,
      "evidence_ids": [
        "RPE-CBA9BA4957BBF4",
        "VIS-1F90C0A6A753CA24"
      ]
    },
    {
      "neutral_reference_file_id": "SRC-ALL-PROJECTS-FILE-7E8A0E23B488",
      "file_sha256": "505A3B3F79E161BAACFC187212D81AFEE909EB9A314E841EC629043A4BD1D634",
      "page_range": "1-2",
      "target_type": "SHEETMETAL_DRAWING",
      "project_identity_status": "CONFIRMED",
      "panel_or_sheet_identity": null,
      "revision_identity": null,
      "supersedes": null,
      "current_effective_status": "CURRENT_EFFECTIVE",
      "classification_method": "METADATA_ROLE_AFTER_RENDERED_PAGE_NO_TEXT",
      "confidence": 0.88,
      "evidence_ids": [
        "RPE-2AB8218F00ABCF",
        "RPE-89E7273B6B95A5",
        "VIS-1F90C0A6A753CA24",
        "VIS-ADE2F1C0861742EF"
      ]
    }
  ],
  "duplicate_groups": [],
  "unresolved_issues": [
    "ELECTRICAL_DRAWINGS_PRESENT_AND_EXCLUDED_FROM_TARGET_SET",
    "UNCLASSIFIED_PAGES_REMAIN"
  ],
  "generator_exposure": {
    "generator_receives_reference_file_ids": false,
    "generator_receives_reference_hashes": false,
    "generator_receives_reference_paths": false,
    "generator_receives_reference_content": false
  },
  "minimization": {
    "raw_text_persisted": false,
    "rendered_images_persisted": false,
    "title_crops_persisted": false,
    "absolute_private_paths_persisted": false,
    "drawing_details_persisted": false
  }
}
