{
  "schema_version": "reference_detection_v3_schema_v1",
  "detector_version": "target_output_detection_v3_page_content_isolated",
  "task_id": "B024-RDV3-B002-1121204",
  "project_id": "1121204",
  "status": "PARTIAL_REFERENCE_SET",
  "target_types_present": [
    "PRODUCTION_DRAWING"
  ],
  "effective_pages": [
    {
      "neutral_reference_file_id": "SRC-ALL-PROJECTS-FILE-459BFA91B40E",
      "file_sha256": "2DC0EE3CC35C14D62D11CC79CA0A640C16EEDC17A2E514AC7599B2791A525ABA",
      "page_range": "1",
      "target_type": "PRODUCTION_DRAWING",
      "project_identity_status": "CONFIRMED",
      "panel_or_sheet_identity": null,
      "revision_identity": null,
      "supersedes": null,
      "current_effective_status": "CURRENT_EFFECTIVE",
      "classification_method": "METADATA_ROLE_AFTER_RENDERED_PAGE_NO_TEXT",
      "confidence": 0.88,
      "evidence_ids": [
        "RPE-0F8504B54F96B7",
        "VIS-DB44A02B340CCEDE"
      ]
    }
  ],
  "duplicate_groups": [],
  "unresolved_issues": [],
  "generator_exposure": {
    "generator_receives_reference_file_ids": false,
    "generator_receives_reference_hashes": false,
    "generator_receives_reference_paths": false,
    "generator_receives_reference_content": false
  },
  "minimization": {
    "raw_text_persisted": false,
    "rendered_images_persisted": false,
    "title_crops_persisted": false,
    "absolute_private_paths_persisted": false,
    "drawing_details_persisted": false
  }
}
