{
  "schema_version": "reference_detection_v3_schema_v1",
  "detector_version": "target_output_detection_v3_page_content_isolated",
  "task_id": "B024-RDV3-B002-1120401",
  "project_id": "1120401",
  "status": "PARTIAL_REFERENCE_SET",
  "target_types_present": [
    "PRODUCTION_DRAWING",
    "SHEETMETAL_DRAWING"
  ],
  "effective_pages": [
    {
      "neutral_reference_file_id": "SRC-ALL-PROJECTS-FILE-AADF595D0B56",
      "file_sha256": "900396188FF7169FF5CEE8F551FE9CC07F8841FA547F33CAE1E898142B20521B",
      "page_range": "1-2",
      "target_type": "PRODUCTION_DRAWING",
      "project_identity_status": "CONFIRMED",
      "panel_or_sheet_identity": null,
      "revision_identity": null,
      "supersedes": null,
      "current_effective_status": "CURRENT_EFFECTIVE",
      "classification_method": "METADATA_ROLE_AFTER_RENDERED_PAGE_NO_TEXT",
      "confidence": 0.88,
      "evidence_ids": [
        "RPE-292F4105C1F324",
        "RPE-805A045E12909D",
        "VIS-1F90C0A6A753CA24",
        "VIS-DB44A02B340CCEDE"
      ]
    },
    {
      "neutral_reference_file_id": "SRC-ALL-PROJECTS-FILE-FBCCE7C8C0B6",
      "file_sha256": "C647B80A65D93BDBDE7AC28D57AF8647C33CABC9DC2692FD71C9FC78D4F80469",
      "page_range": "1-2",
      "target_type": "SHEETMETAL_DRAWING",
      "project_identity_status": "CONFIRMED",
      "panel_or_sheet_identity": null,
      "revision_identity": null,
      "supersedes": null,
      "current_effective_status": "CURRENT_EFFECTIVE",
      "classification_method": "METADATA_ROLE_AFTER_RENDERED_PAGE_NO_TEXT",
      "confidence": 0.88,
      "evidence_ids": [
        "RPE-4B28DFBFE3964E",
        "RPE-BBF0972B4F591A",
        "VIS-1F90C0A6A753CA24",
        "VIS-DB44A02B340CCEDE"
      ]
    }
  ],
  "duplicate_groups": [],
  "unresolved_issues": [
    "ELECTRICAL_DRAWINGS_PRESENT_AND_EXCLUDED_FROM_TARGET_SET",
    "UNCLASSIFIED_PAGES_REMAIN"
  ],
  "generator_exposure": {
    "generator_receives_reference_file_ids": false,
    "generator_receives_reference_hashes": false,
    "generator_receives_reference_paths": false,
    "generator_receives_reference_content": false
  },
  "minimization": {
    "raw_text_persisted": false,
    "rendered_images_persisted": false,
    "title_crops_persisted": false,
    "absolute_private_paths_persisted": false,
    "drawing_details_persisted": false
  }
}
