{
  "schema_version": "reference_detection_v4_schema_v1",
  "detector_version": "target_output_detection_v4_local_multisignal_recovery",
  "task_id": "B024-RDCAL-V4-CAL-1110801",
  "project_id": "1110801",
  "status": "NO_REFERENCE_SET",
  "target_types_present": [],
  "effective_pages": [],
  "duplicate_groups": [
    {
      "original_neutral_reference_file_id": "SRC-ALL-PROJECTS-FILE-C77227009128",
      "duplicate_neutral_reference_file_ids": [
        "SRC-ALL-PROJECTS-FILE-9141C30CE238"
      ]
    }
  ],
  "unresolved_issues": [
    "UNCLASSIFIED_PAGES_REMAIN"
  ],
  "generator_exposure": {
    "generator_receives_reference_file_ids": false,
    "generator_receives_reference_hashes": false,
    "generator_receives_reference_paths": false,
    "generator_receives_reference_content": false
  },
  "minimization": {
    "raw_text_persisted": false,
    "raw_ocr_text_persisted": false,
    "rendered_images_persisted": false,
    "title_crops_persisted": false,
    "absolute_private_paths_persisted": false,
    "drawing_details_persisted": false
  }
}
